{
  "$schema": "http://json-schema.org/draft-07/schema#",
  "additionalProperties": false,
  "properties": {
    "description": {
      "type": "string"
    },
    "frameworks": {
      "items": {
        "properties": {
          "framework_id": {
            "type": "string"
          },
          "framework_title": {
            "type": "string"
          },
          "href": {
            "format": "uri",
            "type": "string"
          }
        },
        "required": [
          "framework_title",
          "framework_id",
          "href"
        ],
        "type": "object"
      },
      "type": "array"
    },
    "id": {
      "$ref": "common.schema.json#/definitions/id"
    },
    "summary": {
      "type": "string"
    },
    "tactic_order": {
      "type": "integer"
    },
    "title": {
      "type": "string"
    }
  },
  "required": [
    "tactic_order",
    "title",
    "summary",
    "frameworks",
    "id"
  ],
  "type": "object"
}
