{
  "description": "",
  "frameworks": [
    {
      "framework_id": "AML.TA0006",
      "framework_title": "MITRE ATLAS",
      "href": "https://atlas.mitre.org/tactics/AML.TA0006"
    },
    {
      "framework_id": "TA0003",
      "framework_title": "MITRE ATT&CK",
      "href": "https://attack.mitre.org/tactics/TA0003/"
    }
  ],
  "id": "$gai-tactics/persistence",
  "summary": "Keep your malicious prompt there for future conversations",
  "tactic_order": 5,
  "title": "Persistence"
}
