{
  "description": "",
  "frameworks": [
    {
      "framework_id": "AML.TA0008",
      "framework_title": "MITRE ATLAS",
      "href": "https://atlas.mitre.org/tactics/AML.TA0008"
    },
    {
      "framework_id": "TA0007",
      "framework_title": "MITRE ATT&CK",
      "href": "https://attack.mitre.org/tactics/TA0007/"
    }
  ],
  "id": "$gai-tactics/discovery",
  "summary": "Understand the capabilities and mitigations in place.",
  "tactic_order": 9,
  "title": "Discovery"
}
