{
  "description": "",
  "frameworks": [
    {
      "framework_id": "AML.TA0013",
      "framework_title": "MITRE ATLAS",
      "href": "https://atlas.mitre.org/tactics/AML.TA0013"
    },
    {
      "framework_id": "TA0006",
      "framework_title": "MITRE ATT&CK",
      "href": "https://attack.mitre.org/tactics/TA0006/"
    }
  ],
  "id": "$gai-tactics/credential_access",
  "summary": "The adversary is trying to steal account names and passwords.",
  "tactic_order": 8,
  "title": "Credential Access"
}
