{
  "description": "",
  "frameworks": [
    {
      "framework_id": "AML.TA0012",
      "framework_title": "MITRE ATLAS",
      "href": "https://atlas.mitre.org/tactics/AML.TA0012"
    },
    {
      "framework_id": "TA0004",
      "framework_title": "MITRE ATT&CK",
      "href": "https://attack.mitre.org/tactics/TA0004/"
    }
  ],
  "id": "$gai-tactics/privilege_escalation",
  "summary": "Confused deputy / Request forgery",
  "tactic_order": 6,
  "title": "Privilege Escalation"
}
