{
  "description": "",
  "frameworks": [
    {
      "framework_id": "TA0008",
      "framework_title": "MITRE ATT&CK",
      "href": "https://attack.mitre.org/tactics/TA0008/"
    }
  ],
  "id": "$gai-tactics/lateral_movement",
  "summary": "The adversary is trying to move through your environment.",
  "tactic_order": 10,
  "title": "Lateral Movement"
}
